{
  "id": "REAL-ESSAYS-2010-2016-001",
  "title": "2010-2016英语一作文真题题型与主题索引",
  "knowledge_type": "diagnostic",
  "status": "reviewing",
  "evidence_level": "source-backed",
  "source_refs": [
    "SRC-ENGLISH1-ESSAYS-2010-2023-DOCX",
    "SRC-ENGLISH1-ESSAYS-2010-2023-AI-PACK",
    "SRC-ENGLISH1-ESSAYS-2016-2025-PDF"
  ],
  "tags": ["英语一", "2010-2016", "真题索引", "图画作文", "小作文"],
  "original_observation": "2010—2016 年资料显示，Task 2 均为图画或图画组作文，统一要求在160—200词内完成画面描述、寓意解释和评论；2014、2016为明显的双图对比，2010、2011、2015带有文字标题或说明。Task 1依次覆盖通知、推荐信/邮件、欢迎与建议、邀请、建议信和信息通知。",
  "ai_analysis": "这七年可以作为图画作文基础训练集：前四年集中训练从单幅画面提炼寓意，2014和2016训练双图对比与关系表达，2015训练科技影响和面对面沟通话题。表格中的主题标签是基于题图、题下注释和公开解析形成的教学判断，不是原题原文。",
  "distilled_rule": "整理真题时将‘年份—题型—题面事实—主题判断—可训练能力’分开记录；题型和任务可标为来源事实，主题标签与迁移建议保持reviewing，直到完成双作者复核和独立写作测试。",
  "teaching_use": "作为图画作文模板、审题训练和主题语料回溯的七年基础样本，也用于检查模板是否覆盖单图、双图、文字说明和对比关系。",
  "template": "First identify the visual form and the most informative detail; then explain the intended meaning; finally connect the theme with a concrete personal or social response.",
  "interpretation": "该条目不是范文库，而是用于检索真题、比较题型变化和安排模板测试的索引。",
  "validation_cases": [
    {"case_id": "ESSAY-2010-TASK2", "result": "pending", "note": "题面和题图已核对；主题迁移测试待完成。"},
    {"case_id": "ESSAY-2011-TASK2", "result": "pending", "note": "题面、标题和题图已核对；主题迁移测试待完成。"},
    {"case_id": "ESSAY-2012-TASK2", "result": "pending", "note": "题面和题图已核对；主题迁移测试待完成。"},
    {"case_id": "ESSAY-2013-TASK2", "result": "pending", "note": "题面和题图已核对；主题迁移测试待完成。"},
    {"case_id": "ESSAY-2014-TASK2", "result": "pending", "note": "双图题面和题图已核对；双图模板测试待完成。"},
    {"case_id": "ESSAY-2015-TASK2", "result": "pending", "note": "题面、标题和题图已核对；科技沟通主题测试待完成。"},
    {"case_id": "ESSAY-2016-TASK2", "result": "pending", "note": "双图题面和题图已由另一份PDF交叉核对；双图模板测试待完成。"}
  ],
  "conflicts": [
    "2010—2023汇总资料保留原题措辞，但本产品表采用任务摘要，避免在公开仓库复制完整真题文本。",
    "部分主题标签来自图像分析和公开解析，不能伪装成题面原文。",
    "2010—2016资料包还包含2017—2026内容，本条目只覆盖用户指定的2010—2016。"
  ],
  "review": {
    "owner": "Codex",
    "last_reviewed": "2026-10-14",
    "reviewers": [],
    "next_action": "两位作者分别用七道Task 2真题测试现有图画模板，比较首段审题准确性、双图关系表达、主题词替换和词数控制。"
  }
}
